{
	"id": "stm-stm32u585-lqfp100-smps",
	"vendor": "STMicroelectronics",
	"family": "STM32U585",
	"name": "STM32U585 LQFP100 SMPS",
	"version": "0.2.0",
	"description": "Generated from the STM32U585 alternate-function workbook and STM32U585AI datasheet for STM32U585 LQFP100 SMPS. This definition models the LQFP100 SMPS package with per-signal routing synthesized from Sheet1 package pins and Sheet2 AF0-AF15 matrix data. STM32U585 devices pair an ultra-low-power Cortex-M33 core with TrustZone, up to 2 Mbytes of flash memory, 786 Kbytes of SRAM, and cryptography support across broad package options. This package definition exposes 54 peripheral blocks covering 9 timers, 4 low-power timers, 6 serial ports, 3 SPI controllers, 4 I2C controllers, 2 serial audio interfaces, 2 SDMMC host interfaces, 1 FDCAN controller, 1 USB OTG interface, 2 ADC instances, a dual-channel DAC, 2 on-chip operational amplifiers, 2 ultra-low-power comparators, a digital camera interface, and 1 USB Type-C / Power Delivery controller.",
	"package": {
		"name": "LQFP100 SMPS",
		"kind": "quad",
		"pinCount": 100,
		"numbering": "ccw",
		"orientationMark": "top-left",
		"pinsPerSide": 25,
		"rowPinCount": null,
		"bodyLabel": "STM32U585"
	},
	"pins": [
		{
			"id": "PE2",
			"packageNumber": "1",
			"name": "PE2",
			"supportedModes": ["auto", "gpio-input", "gpio-output", "analog"]
		},
		{
			"id": "PE3",
			"packageNumber": "2",
			"name": "PE3",
			"supportedModes": ["auto", "gpio-input", "gpio-output", "analog"]
		},
		{
			"id": "PE4",
			"packageNumber": "3",
			"name": "PE4",
			"supportedModes": ["auto", "gpio-input", "gpio-output", "analog"]
		},
		{
			"id": "PE5",
			"packageNumber": "4",
			"name": "PE5",
			"supportedModes": ["auto", "gpio-input", "gpio-output", "analog"]
		},
		{
			"id": "PE6",
			"packageNumber": "5",
			"name": "PE6",
			"supportedModes": ["auto", "gpio-input", "gpio-output"]
		},
		{
			"id": "VBAT",
			"packageNumber": "6",
			"name": "VBAT",
			"supportedModes": ["auto"]
		},
		{
			"id": "PC13",
			"packageNumber": "7",
			"name": "PC13",
			"supportedModes": ["auto", "gpio-input", "gpio-output"]
		},
		{
			"id": "PC14",
			"packageNumber": "8",
			"name": "PC14-OSC32_IN",
			"supportedModes": ["auto", "gpio-input", "gpio-output"]
		},
		{
			"id": "PC15",
			"packageNumber": "9",
			"name": "PC15-OSC32_OUT",
			"supportedModes": ["auto", "gpio-input", "gpio-output"]
		},
		{
			"id": "VSS",
			"packageNumber": "10",
			"name": "VSS",
			"supportedModes": ["auto"]
		},
		{
			"id": "VDD",
			"packageNumber": "11",
			"name": "VDD",
			"supportedModes": ["auto"]
		},
		{
			"id": "PH0",
			"packageNumber": "12",
			"name": "PH0-OSC_IN",
			"supportedModes": ["auto", "gpio-input", "gpio-output"]
		},
		{
			"id": "PH1",
			"packageNumber": "13",
			"name": "PH1-OSC_OUT",
			"supportedModes": ["auto", "gpio-input", "gpio-output"]
		},
		{
			"id": "NRST",
			"packageNumber": "14",
			"name": "NRST",
			"supportedModes": ["auto", "gpio-input", "gpio-output"]
		},
		{
			"id": "PC0",
			"packageNumber": "15",
			"name": "PC0",
			"supportedModes": ["auto", "gpio-input", "gpio-output", "analog"]
		},
		{
			"id": "PC1",
			"packageNumber": "16",
			"name": "PC1",
			"supportedModes": ["auto", "gpio-input", "gpio-output", "analog"]
		},
		{
			"id": "PC2",
			"packageNumber": "17",
			"name": "PC2",
			"supportedModes": ["auto", "gpio-input", "gpio-output", "analog"]
		},
		{
			"id": "PC3",
			"packageNumber": "18",
			"name": "PC3",
			"supportedModes": ["auto", "gpio-input", "gpio-output", "analog"]
		},
		{
			"id": "VSSA",
			"packageNumber": "19",
			"name": "VSSA",
			"supportedModes": ["auto"]
		},
		{
			"id": "VREF_PLUS",
			"packageNumber": "20",
			"name": "VREF+",
			"supportedModes": ["auto"]
		},
		{
			"id": "VDDA",
			"packageNumber": "21",
			"name": "VDDA",
			"supportedModes": ["auto"]
		},
		{
			"id": "PA0",
			"packageNumber": "22",
			"name": "PA0",
			"supportedModes": ["auto", "gpio-input", "gpio-output", "analog"]
		},
		{
			"id": "PA1",
			"packageNumber": "23",
			"name": "PA1",
			"supportedModes": ["auto", "gpio-input", "gpio-output", "analog"]
		},
		{
			"id": "PA2",
			"packageNumber": "24",
			"name": "PA2",
			"supportedModes": ["auto", "gpio-input", "gpio-output", "analog"]
		},
		{
			"id": "PA3",
			"packageNumber": "25",
			"name": "PA3",
			"supportedModes": ["auto", "gpio-input", "gpio-output", "analog"]
		},
		{
			"id": "VSS_26",
			"packageNumber": "26",
			"name": "VSS",
			"supportedModes": ["auto"]
		},
		{
			"id": "VDD_27",
			"packageNumber": "27",
			"name": "VDD",
			"supportedModes": ["auto"]
		},
		{
			"id": "PA4",
			"packageNumber": "28",
			"name": "PA4",
			"supportedModes": ["auto", "gpio-input", "gpio-output", "analog"]
		},
		{
			"id": "PA5",
			"packageNumber": "29",
			"name": "PA5",
			"supportedModes": ["auto", "gpio-input", "gpio-output", "analog"]
		},
		{
			"id": "PA6",
			"packageNumber": "30",
			"name": "PA6",
			"supportedModes": ["auto", "gpio-input", "gpio-output", "analog"]
		},
		{
			"id": "PA7",
			"packageNumber": "31",
			"name": "PA7",
			"supportedModes": ["auto", "gpio-input", "gpio-output", "analog"]
		},
		{
			"id": "PB0",
			"packageNumber": "32",
			"name": "PB0",
			"supportedModes": ["auto", "gpio-input", "gpio-output", "analog"]
		},
		{
			"id": "PB1",
			"packageNumber": "33",
			"name": "PB1",
			"supportedModes": ["auto", "gpio-input", "gpio-output", "analog"]
		},
		{
			"id": "PB2",
			"packageNumber": "34",
			"name": "PB2",
			"supportedModes": ["auto", "gpio-input", "gpio-output", "analog"]
		},
		{
			"id": "PE7",
			"packageNumber": "35",
			"name": "PE7",
			"supportedModes": ["auto", "gpio-input", "gpio-output"]
		},
		{
			"id": "PE8",
			"packageNumber": "36",
			"name": "PE8",
			"supportedModes": ["auto", "gpio-input", "gpio-output"]
		},
		{
			"id": "PE9",
			"packageNumber": "37",
			"name": "PE9",
			"supportedModes": ["auto", "gpio-input", "gpio-output"]
		},
		{
			"id": "PE10",
			"packageNumber": "38",
			"name": "PE10",
			"supportedModes": ["auto", "gpio-input", "gpio-output", "analog"]
		},
		{
			"id": "PE11",
			"packageNumber": "39",
			"name": "PE11",
			"supportedModes": ["auto", "gpio-input", "gpio-output", "analog"]
		},
		{
			"id": "PE12",
			"packageNumber": "40",
			"name": "PE12",
			"supportedModes": ["auto", "gpio-input", "gpio-output", "analog"]
		},
		{
			"id": "PE13",
			"packageNumber": "41",
			"name": "PE13",
			"supportedModes": ["auto", "gpio-input", "gpio-output", "analog"]
		},
		{
			"id": "PE14",
			"packageNumber": "42",
			"name": "PE14",
			"supportedModes": ["auto", "gpio-input", "gpio-output"]
		},
		{
			"id": "PE15",
			"packageNumber": "43",
			"name": "PE15",
			"supportedModes": ["auto", "gpio-input", "gpio-output"]
		},
		{
			"id": "PB10",
			"packageNumber": "44",
			"name": "PB10",
			"supportedModes": ["auto", "gpio-input", "gpio-output", "analog"]
		},
		{
			"id": "PB11",
			"packageNumber": "45",
			"name": "PB11",
			"supportedModes": ["auto", "gpio-input", "gpio-output", "analog"]
		},
		{
			"id": "VLXSMPS",
			"packageNumber": "46",
			"name": "VLXSMPS",
			"supportedModes": ["auto"]
		},
		{
			"id": "VDDSMPS",
			"packageNumber": "47",
			"name": "VDDSMPS",
			"supportedModes": ["auto"]
		},
		{
			"id": "VSSSMPS",
			"packageNumber": "48",
			"name": "VSSSMPS",
			"supportedModes": ["auto"]
		},
		{
			"id": "VDD11",
			"packageNumber": "49",
			"name": "VDD11",
			"supportedModes": ["auto"]
		},
		{
			"id": "VSS_50",
			"packageNumber": "50",
			"name": "VSS",
			"supportedModes": ["auto"]
		},
		{
			"id": "VDD_51",
			"packageNumber": "51",
			"name": "VDD",
			"supportedModes": ["auto"]
		},
		{
			"id": "PB13",
			"packageNumber": "52",
			"name": "PB13",
			"supportedModes": ["auto", "gpio-input", "gpio-output", "analog"]
		},
		{
			"id": "PB14",
			"packageNumber": "53",
			"name": "PB14",
			"supportedModes": ["auto", "gpio-input", "gpio-output", "analog"]
		},
		{
			"id": "PB15",
			"packageNumber": "54",
			"name": "PB15",
			"supportedModes": ["auto", "gpio-input", "gpio-output"]
		},
		{
			"id": "PD8",
			"packageNumber": "55",
			"name": "PD8",
			"supportedModes": ["auto", "gpio-input", "gpio-output"]
		},
		{
			"id": "PD9",
			"packageNumber": "56",
			"name": "PD9",
			"supportedModes": ["auto", "gpio-input", "gpio-output"]
		},
		{
			"id": "PD10",
			"packageNumber": "57",
			"name": "PD10",
			"supportedModes": ["auto", "gpio-input", "gpio-output", "analog"]
		},
		{
			"id": "PD11",
			"packageNumber": "58",
			"name": "PD11",
			"supportedModes": ["auto", "gpio-input", "gpio-output", "analog"]
		},
		{
			"id": "PD12",
			"packageNumber": "59",
			"name": "PD12",
			"supportedModes": ["auto", "gpio-input", "gpio-output", "analog"]
		},
		{
			"id": "PD13",
			"packageNumber": "60",
			"name": "PD13",
			"supportedModes": ["auto", "gpio-input", "gpio-output", "analog"]
		},
		{
			"id": "PD14",
			"packageNumber": "61",
			"name": "PD14",
			"supportedModes": ["auto", "gpio-input", "gpio-output"]
		},
		{
			"id": "PD15",
			"packageNumber": "62",
			"name": "PD15",
			"supportedModes": ["auto", "gpio-input", "gpio-output"]
		},
		{
			"id": "PC6",
			"packageNumber": "63",
			"name": "PC6",
			"supportedModes": ["auto", "gpio-input", "gpio-output", "analog"]
		},
		{
			"id": "PC7",
			"packageNumber": "64",
			"name": "PC7",
			"supportedModes": ["auto", "gpio-input", "gpio-output", "analog"]
		},
		{
			"id": "PC8",
			"packageNumber": "65",
			"name": "PC8",
			"supportedModes": ["auto", "gpio-input", "gpio-output", "analog"]
		},
		{
			"id": "PC9",
			"packageNumber": "66",
			"name": "PC9",
			"supportedModes": ["auto", "gpio-input", "gpio-output", "analog"]
		},
		{
			"id": "PA8",
			"packageNumber": "67",
			"name": "PA8",
			"supportedModes": ["auto", "gpio-input", "gpio-output"]
		},
		{
			"id": "PA9",
			"packageNumber": "68",
			"name": "PA9",